{
  "ticker": "PLTR",
  "company_name": "Palantir Technologies Inc.",
  "ats_platform": "greenhouse",
  "careers_url": "https://www.palantir.com/careers/",
  "application_url": "https://boards.greenhouse.io/palantir/jobs/{job_id}",
  "api_endpoint": "https://boards-api.greenhouse.io/v1/boards/palantir/jobs",
  "search_filters": [
    {
      "name": "Team",
      "type": "url_param",
      "url_param": "team",
      "options": []
    },
    {
      "name": "Location",
      "type": "url_param",
      "url_param": "location",
      "options": []
    }
  ],
  "application_flow": [
    {
      "step": 1,
      "action": "Navigate to job posting page",
      "selector": "a[href*='boards.greenhouse.io/palantir/jobs']",
      "field_type": "text",
      "value_key": "job_url",
      "notes": "Click 'Apply' button on Palantir careers page to reach Greenhouse form",
      "required": true
    },
    {
      "step": 2,
      "action": "Fill first name",
      "selector": "#first_name",
      "field_type": "text",
      "value_key": "first_name",
      "notes": "Standard text input for first name",
      "required": true
    },
    {
      "step": 3,
      "action": "Fill last name",
      "selector": "#last_name",
      "field_type": "text",
      "value_key": "last_name",
      "notes": "Standard text input for last name",
      "required": true
    },
    {
      "step": 4,
      "action": "Fill email",
      "selector": "#email",
      "field_type": "email",
      "value_key": "email",
      "notes": "Standard email input",
      "required": true
    },
    {
      "step": 5,
      "action": "Fill phone",
      "selector": "#phone",
      "field_type": "tel",
      "value_key": "phone",
      "notes": "Standard phone input",
      "required": true
    },
    {
      "step": 6,
      "action": "Upload resume",
      "selector": "input[type='file'][data-field='resume']",
      "field_type": "file",
      "value_key": "resume_path",
      "notes": "Hidden file input triggered by 'Attach' button.",
      "required": true
    },
    {
      "step": 7,
      "action": "Fill LinkedIn URL",
      "selector": "input[name*='linkedin']",
      "field_type": "url",
      "value_key": "linkedin_url",
      "notes": "LinkedIn profile URL field",
      "required": false
    },
    {
      "step": 8,
      "action": "Select work authorization via ARIA combobox",
      "selector": "[role='combobox'][aria-label*='authorized']",
      "field_type": "combobox",
      "value_key": "work_authorization",
      "notes": "ARIA combobox widget: click to open -> take snapshot -> click matching option.",
      "required": true
    },
    {
      "step": 9,
      "action": "Select sponsorship requirement via ARIA combobox",
      "selector": "[role='combobox'][aria-label*='sponsorship']",
      "field_type": "combobox",
      "value_key": "needs_sponsorship",
      "notes": "ARIA combobox widget: click to open -> take snapshot -> click matching option.",
      "required": true
    },
    {
      "step": 10,
      "action": "Submit application",
      "selector": "input[type='submit'], button[type='submit']",
      "field_type": "text",
      "value_key": "",
      "notes": "Invisible reCAPTCHA Enterprise triggers on submit.",
      "required": true
    }
  ],
  "quirks": [
    {
      "id": "gh-aria-combobox",
      "description": "Greenhouse uses ARIA combobox widgets for dropdowns instead of standard <select> elements.",
      "workaround": "Use click-snapshot-click pattern: 1) Click the combobox to open, 2) Take a page snapshot to find options, 3) Click the matching option.",
      "severity": "warning"
    },
    {
      "id": "gh-recaptcha-enterprise",
      "description": "Form has invisible reCAPTCHA Enterprise that triggers on submit.",
      "workaround": "Prepare human-in-the-loop fallback for CAPTCHA challenges.",
      "severity": "blocker"
    },
    {
      "id": "gh-file-upload-hidden",
      "description": "Resume upload uses a hidden file input triggered by an 'Attach' button overlay.",
      "workaround": "Use setInputFiles() on the hidden input or click Attach button and handle file dialog.",
      "severity": "warning"
    },
    {
      "id": "gh-api-available",
      "description": "Greenhouse public API available for job listings.",
      "workaround": "Use GET https://boards-api.greenhouse.io/v1/boards/palantir/jobs for job data.",
      "severity": "info"
    }
  ],
  "verified": true,
  "last_verified": "2026-02-25",
  "notes": "Palantir uses Greenhouse. Careers page at palantir.com redirects to Greenhouse forms for applications."
}
